Original Text,Label,Emotional Reasoning,Overgeneralization,Should Statements,Personalization,Mental Filter,Disqualifying the Positive,Jumping to Conclusions,Labeling and Mislabeling,Magnification and Minimization,All-or-Nothing Thinking
"Tại sao bây giờ tôi lại hối hận vì trước đây đã không nghiêm túc với những người có cảm tình với mình, cảm thấy mình đã lớn tuổi mà không có kinh nghiệm yêu đương, cuộc đời thật trống rỗng.",1,0,0,1,0,0,0,0,0,0,0
"Không kiềm chế được muốn ăn, dù no rồi vẫn muốn ăn, ăn nhiều thì nôn, nôn xong vẫn muốn ăn, thèm ăn không kiểm soát được, cân nặng tăng 20 cân, rất đau khổ.",1,0,0,1,0,0,0,0,0,0,0
"Luôn không thể kiểm soát bản thân, thời gian chơi điện thoại, xem máy tính cũng rất nhiều, mệt thì đi ngủ, việc học thì không làm trừ khi bất đắc dĩ, không biết trạng thái này phải sửa đổi thế nào, luôn không thể kiểm soát bản thân",1,0,0,1,0,0,0,0,0,0,0
"Tò mò, muốn nhìn một bản thân khác, bình thường quá mệt mỏi, bố mẹ học hành, ép chặt, trong mắt họ, chơi game như ăn thuốc độc vậy",1,0,0,1,0,0,0,0,0,0,0
"Muốn cố gắng học tập, nhưng luôn trì hoãn không làm được, làm thế nào mới làm được???",1,0,0,1,0,0,0,0,0,0,0
"Cứ đến cuối tuần, có rất nhiều việc đã quyết định làm, nhưng lại muốn nằm ườn trên giường, luôn lãng phí rất nhiều thời gian trên giường, phải làm sao",1,0,0,1,0,0,0,0,0,0,0
"Con gái đã kết hôn sinh con, mẹ chồng trông cháu, cô ấy cảm thấy tôi không góp sức thì nên góp tiền, khắp nơi soi mói bố mẹ, tỏ thái độ với bố mẹ",1,0,0,1,0,0,0,0,0,0,0
"Học cao học, mỗi ngày đều không thể ngủ sớm, ngủ rất muộn rồi dậy cũng rất muộn, thời gian học mỗi ngày bị rút ngắn rất nhiều, biết mình đang trốn tránh, nhưng nên làm gì đây?",1,0,0,1,0,0,0,0,0,0,0
"Không còn yêu chồng nữa, muốn ly hôn, nhưng có con, mọi người đều nói vì con, hãy cố gắng duy trì hôn nhân đi. Tôi chỉ muốn sống một mình thôi",1,0,0,1,0,0,0,0,0,0,0
"Đôi khi cảm thấy mình không đạt được kỳ vọng của người khác, cảm thấy rất tội lỗi, rồi sẽ suy nghĩ về chuyện đó cả ngày rất buồn, rồi rất hối hận tại sao không làm tốt hơn một chút thì phải làm sao?",1,0,0,1,0,0,0,0,0,0,0
"Mỗi ngày tôi đều lập kế hoạch, đều nghĩ phải hoàn thành nhưng mỗi lần đều không hoàn thành được, phát sinh lo lắng, vấn đề này phải giải quyết như thế nào?",1,0,0,1,0,0,0,0,0,0,0
"Rất thích làm tình, cảm thấy cảm giác này rất viên mãn nhưng sau khi làm xong lại rất tự trách, không kiềm chế được ham muốn của bản thân. Đã phiền muộn rất lâu rồi.",1,0,0,1,0,0,0,0,0,0,0
"Thi đại học kết quả quá khác so với mong đợi, hơi không chấp nhận được, nhưng không muốn thi lại, chỉ có thể vào một trường đại học bình thường, trong lòng không cam tâm, rất hối hận",1,0,0,1,0,0,0,0,0,0,0
"Bất kể là chuyện gì cũng mong muốn phát triển theo ý mình mới vui? Hơi khác một chút thôi là sẽ đặc biệt tức giận, bực bội. Đây là tại sao? Là vấn đề tâm lý sao?",1,0,0,1,0,0,0,0,0,0,0
"Đang làm bài tập thì rất muốn chơi điện thoại, không biết phải làm sao, không kiểm soát được bản thân. Thật là bực bội quá đi mất.",1,0,0,1,0,0,0,0,0,0,0
"Rõ ràng biết đối phương cũng rất bận rộn và có thế giới riêng của mình, nhưng vẫn hy vọng đối phương có thể dành thêm một chút thời gian cho mình. Suy nghĩ như vậy có ích kỷ không?",1,0,0,1,0,0,0,0,0,0,0
"Làm thế nào tôi có thể từ bỏ những kỳ vọng không thực tế, từ bỏ việc luôn hy vọng một người không thể quay lại, từ bỏ việc tự hành hạ bản thân",1,0,0,1,0,0,0,0,0,0,0
"Tại sao không thể luôn giữ khách quan và bình tĩnh? Đặc biệt khi mệt mỏi, dễ cáu kỉnh?",1,0,0,1,0,0,0,0,0,0,0
"Những việc muốn làm luôn có một chút không phù hợp với quy tắc của riêng tôi, nên rất mâu thuẫn, vì vậy những việc muốn làm vẫn chưa bắt đầu",1,0,0,1,0,0,0,0,0,0,0
"Thiếu thốn tình yêu, không tự yêu bản thân, đã làm một số việc sai trái, ban đầu không cảm thấy gì, mấy năm gần đây bắt đầu tự trách, hối hận, thỉnh thoảng nhớ lại giày vò bản thân, không thể quên được.",1,0,0,1,0,0,0,0,0,0,0
"Nhà có học sinh lớp 3, trong quá trình con lớn lên đã đọc rất nhiều sách nuôi dạy con, nhưng gặp phải con lề mề không nghe lời, không kiềm chế được nổi nóng, phải làm sao?",1,0,0,1,0,0,0,0,0,0,0
"Một người cha mẹ thường xuyên mang cảm xúc của mình vào gia đình, trút lên con cái, có phải là một người cha mẹ đủ tiêu chuẩn không?",1,0,0,1,0,0,0,0,0,0,0
"Đôi khi, rõ ràng biết có những việc không nên làm nhưng vẫn cứ làm, rõ ràng biết có những hố không nên rơi nhưng vẫn cứ rơi, rõ ràng biết có những người không nên yêu nhưng vẫn cứ yêu. Nhưng tại sao lại cứ 'nhất định phải' như vậy?",1,0,0,1,0,0,0,0,0,0,0
"Khi không đạt được yêu cầu của cha mẹ, luôn có cảm giác tội lỗi, làm thế nào để giải quyết?",1,0,0,1,0,0,0,0,0,0,0
"Làm những việc mình sợ có phải là không yêu bản thân, trái với nội tâm của mình không?",1,0,0,1,0,0,0,0,0,0,0
"Đã học một số kiến thức tâm lý học, hiểu rõ vấn đề của mình, nhưng lại luôn rơi vào những khuôn mẫu cũ, dậm chân tại chỗ, không hành động, đây là chuyện gì vậy? Nên giải quyết như thế nào?",1,0,0,1,0,0,0,0,0,0,0
"Cảm thấy mình đã nói những lời không phù hợp, cứ canh cánh trong lòng. Sẽ luôn tự nhốt mình vào đó, tự trách bản thân quá khắt khe với chính mình. Phải làm sao?",1,0,0,1,0,0,0,0,0,0,0
"Giai đoạn hiện tại mỗi ngày không kiềm chế được mà ăn rất nhiều đến mức no muốn ói rồi lại tiếp tục ăn cho đến khi không còn gì để ăn, đôi khi ăn xong còn đi mua những thứ không muốn ăn, không thích ăn nhưng vẫn không thể kiểm soát bản thân.",1,0,0,1,0,0,0,0,0,0,0
"Tại sao lại cảm thấy việc thủ dâm khi độc thân là một loại không có chí khí, lãng phí thời gian và sức lực, làm một việc sai lầm vào đúng thời điểm, thiếu trải nghiệm cuộc sống?",1,0,0,1,0,0,0,0,0,0,0
"Dễ nổi nóng, học không phải vì mình mà vì cha mẹ, nói không ép nhưng lại dùng đạo đức ràng buộc, họ không dễ thì tôi dễ sao? Sống rất không vui, từng có ý định tự tử rất mạnh.",1,0,0,1,0,0,0,0,0,0,0
"Khi mình không hài lòng với ai đó, tại sao không chọn tìm một nơi nào đó lặng lẽ trút giận hoặc trút giận trước mặt người khác, mà lại có xu hướng tự hủy hoại bản thân?",1,0,0,1,0,0,0,0,0,0,0
"Đôi khi cảm thấy mình không đạt được kỳ vọng của người khác, cảm thấy mình rất tệ, cứ nghĩ mãi về chuyện này rất buồn, rồi lại lẩm bẩm gì đó trong miệng rồi rất hối hận, đây là vấn đề gì? Tôi phải làm sao?",1,0,0,1,0,0,0,0,0,0,0
"Người giỏi hơn tôi vẫn nỗ lực, tôi biết mình cũng đã rất cố gắng rồi, nhưng nhìn thấy người giỏi hơn tôi nỗ lực, tôi lại cảm thấy có phải mình chưa đủ cố gắng không, trong lòng rất khó chịu.",1,0,0,1,0,0,0,0,0,0,0
"Cảm thấy mình luôn bị người khác phá vỡ quy tắc đủ kiểu, tính toán thì cũng không phải chuyện gì to tát, không tính toán thì ngày mai cũng vậy, luôn cảm thấy mình có phải quá nhỏ nhen, hay tính toán không?",1,0,0,1,0,0,0,0,0,0,0
"Nghiện xem phim đen và thủ dâm, mỗi lần đều thủ dâm liên tục mấy lần, đã bị liệt dương sớm nhưng vẫn không kiểm soát được việc xem phim đen và thủ dâm, cơ thể đã xuất hiện nhiều triệu chứng bao gồm suy thận, nhưng tôi không thể cai được, phải làm sao?",1,0,0,1,0,0,0,0,0,0,0
"Trẻ vị thành niên hằn học, soi mói cha mẹ, không cho cha mẹ nói bất cứ lời chỉ trích nào, chỉ đòi hỏi mà không chịu trách nhiệm.",1,0,0,1,0,0,0,0,0,0,0
"Luôn làm những việc mình không muốn làm, bỏ qua nhu cầu và cảm xúc của mình, lại cảm thấy mình không có khả năng sống cuộc sống mình mong muốn, vô cùng đau khổ, tôi muốn thoát khỏi trạng thái này?",1,0,0,1,0,0,0,0,0,0,0
"Người khác nói ba mươi tuổi lập nghiệp, nhưng tôi lại ở tuổi ba mươi mất trắng, bây giờ vẫn không kiềm chế được bản thân, chỉ cần có tiền là muốn đi gỡ lại, tôi phải làm sao đây?",1,0,0,1,0,0,0,0,0,0,0
"Từ nhỏ đến lớn, tôi luôn phải kìm nén, bây giờ có con vì cơ thể không khỏe, mệt mỏi, nhưng mọi người trong nhà đều nói tôi làm quá, nhưng tôi thực sự rất mệt mỏi, tôi nghĩ tôi bị bệnh rồi, nhưng không ai tin tôi.",1,0,0,1,0,0,0,0,0,0,0
"Chồng ngoại tình, anh ấy cũng không thể tự thoát ra được, vẫn liên lạc với người kia, tôi thực sự không muốn ở cùng anh ấy nữa, tôi muốn trốn tránh, nhưng mọi người xung quanh đều bảo tôi nhẫn nhịn, vì con trai. Tôi rất mệt mỏi",1,0,0,1,0,0,0,0,0,0,0
"Mỗi khi đêm xuống, tôi lại mong có ai đó quan tâm đến tôi và trò chuyện với tôi thật tốt, yêu thương tôi như người yêu, nhưng bây giờ tôi rất bận, không có thời gian để kết bạn và yêu đương, nhưng lại muốn tình yêu ấm áp, phải làm sao?",1,0,0,1,0,0,0,0,0,0,0
"Tôi thi cử xong, bố tôi chưa bao giờ quan tâm đến việc học của tôi, biết điểm của tôi rồi hỏi tôi tại sao lần này lại thi kém như vậy, trong lòng họ tôi phải đứng trong top 10 thậm chí top 3",1,0,0,1,0,0,0,0,0,0,0
"Đôi khi làm xong việc lại hối hận, cảm thấy mình làm không tốt, rất tức giận với bản thân",1,0,0,1,0,0,0,0,0,0,0
"Mất kiểm soát không lý do, tôi thực sự không muốn mãi bị ảnh hưởng bởi cảm xúc tiêu cực. Tôi không nên như vậy, muốn chết nhưng sợ đau. Mẹ tôi rất thương tôi, ăn uống cũng chiều tôi, tôi không nên như vậy, không nên, thật bất lực",1,0,0,1,0,0,0,0,0,0,0
"Luôn chiều theo người khác, người khác tốt với mình là thấy khó chịu, chỉ có thể không ngừng付出, chiều theo, rốt cuộc là chuyện gì vậy",1,0,0,1,0,0,0,0,0,0,0
"Cố gắng thay đổi bản thân, nhưng không biết làm thế nào để thực hiện, sống trong hiện tại thật khó khăn.",1,0,0,1,0,0,0,0,0,0,0
"Tôi rất lười, có thể chơi điện thoại liên tục mấy ngày. Đồng thời lại không ngừng tự trách mình, cảm thấy rất sa đọa. Nhưng lại sợ khó, hoàn toàn không muốn học, cứ nhìn sách là thấy chán.",1,0,0,1,0,0,0,0,0,0,0
"Trong một năm gần đây, tôi luôn tự trừng phạt bản thân, ví dụ như thường xuyên không ăn cơm",1,0,0,1,0,0,0,0,0,0,0
"Khi đối phương đưa ra một vấn đề, không cho phép người khác phản bác, đều phải theo ý của anh ta, rồi nói bạn làm cái này không tốt, cái kia không tốt. Lúc này nên làm gì?",1,0,0,1,0,0,0,0,0,0,0
Luôn cảm thấy mình sống không có ý nghĩa? Hình như sống vì người khác? Làm sao mới có thể sống là chính mình?,1,0,0,1,0,0,0,0,0,0,0
"Nghĩ đến việc mình phải làm là thấy mệt mỏi trong lòng, không muốn đối mặt. Muốn ngủ vùi, cứ ngủ mãi, không quan tâm thế giới bên ngoài thế nào, chỉ muốn yên tĩnh ngẩn ngơ. Nhưng lại cảm thấy mình nên đối mặt, nên rất lo lắng.",1,0,0,1,0,0,0,0,0,0,0
"Tính cách lấy lòng người khác, quá khách sáo với người khác, không biết từ chối, không dám cãi nhau, luôn chủ động làm hòa, tự chịu thiệt thòi.",1,0,0,1,0,0,0,0,0,0,0
"Trước đây tôi tự cho là có khả năng chịu áp lực rất tốt, nhưng bây giờ lại cảm thấy ngày càng kém, hơn nữa lại tự làm khó mình (vì những người xung quanh, gia đình đều cho rằng tôi có khả năng chịu áp lực tốt), ép mình phải tỏ ra chịu áp lực?",1,0,0,1,0,0,0,0,0,0,0
"Thấy người khác gặp chuyện không hay hoặc nhờ vả tôi, ban đầu tôi nghĩ không cần mình bận tâm hoặc không muốn bận tâm, nhưng rồi lại mềm lòng, luôn không thể từ chối yêu cầu của người khác. Phải làm sao?",1,0,0,1,0,0,0,0,0,0,0
"Bây giờ tôi học lớp 12, tôi thấy tự giác là cực kỳ quan trọng. Nhưng tôi vẫn rất ham chơi, dường như không có mục tiêu rõ ràng. Không biết phải làm sao.",1,0,0,1,0,0,0,0,0,0,0
"Thường xuyên trách mẹ nói thế này không tốt, làm thế kia không đúng, sau đó lại hối hận không nên áp đặt ý muốn của mình lên mẹ.",1,0,0,1,0,0,0,0,0,0,0
"Cảm thấy mình phải cố gắng hơn người khác mới có thể sống sót, công việc của tôi vất vả hơn người khác, áp lực và đau khổ phải chịu cũng gấp đôi người khác, cảm thấy cuộc đời không công bằng.",1,0,0,1,0,0,0,0,0,0,0
Tại sao một số người không hề nỗ lực nhưng lại biện hộ rằng mình không có tài năng?,1,0,0,1,0,0,0,0,0,0,0
"Rõ ràng tôi là người không có lý tưởng, không có theo đuổi, tại sao vẫn phải cố gắng?",1,0,0,1,0,0,0,0,0,0,0
"Lãnh đạo không hiểu nghiệp vụ, lại không chịu học hỏi tìm hiểu, nhưng lại rất thích chỉ tay năm ngón, tôi phải làm sao? Nhiều điều anh ấy nói với chúng tôi đều sai.",1,0,0,1,0,0,0,0,0,0,0
"Luôn cảm thấy cách thức giao tiếp không đúng, không thoải mái, trong lòng cũng rất bối rối, một mô hình hôn nhân tốt nên như thế nào, tôi nghĩ độc lập là cơ sở, đối phương muốn gắn bó với nhau, khó chịu.",1,0,0,1,0,0,0,0,0,0,0
"Bản thân cũng đã học một số tâm lý học, nhưng luôn cảm thấy làm chưa đủ tốt. Tôi sợ gia đình gốc của mình sẽ ảnh hưởng đến con cái.",1,0,0,1,0,0,0,0,0,0,0
"Con tôi sắp học lớp 6 rồi, sự tập trung thực sự không có chút nào, tôi giảng bài thì nó mơ màng, bảo nó làm bài tập thì nó nhìn đông nhìn tây, với khả năng của nó 5 phút là làm xong, 30 phút vẫn chưa xong, tôi rất sốt ruột muốn đánh nó.",1,0,0,1,0,0,0,0,0,0,0
"Luôn không cam lòng, việc gì cũng muốn tốt hơn người khác, không thể tận hưởng cuộc sống một cách trọn vẹn.",1,0,0,1,0,0,0,0,0,0,0
"Áp lực công việc, luôn muốn làm mọi thứ hoàn hảo, sau đó lo lắng cảm thấy không có phương hướng.",1,0,0,1,0,0,0,0,0,0,0
"Sắp khai giảng rồi, sau khai giảng là phải thi, mà tôi vẫn đang trong thời gian làm thêm, nên tôi thường xuyên lo lắng, nhưng tôi lại không chịu hành động thực tế, nên cảm xúc rất hỗn loạn.",1,0,0,1,0,0,0,0,0,0,0
"Đối mặt với yêu cầu của người khác, không thể từ chối. Đã quen với sự yếu đuối và nhượng bộ!! Và không thể chấp nhận bản thân như vậy.",1,0,0,1,0,0,0,0,0,0,0
Mỗi ngày đều đặc biệt tự ti không muốn thủ dâm nhưng rất khó bỏ tôi đang cố gắng muốn xem ai có cách nào hay không?,1,0,0,1,0,0,0,0,0,0,0
"Không thể ngủ ngon, trước khi ngủ luôn làm đủ thứ việc ảnh hưởng đến giấc ngủ, làm thế nào để thay đổi trạng thái này?",1,0,0,1,0,0,0,0,0,0,0
"Luôn mong người khác tốt hơn mình, đặc biệt là những người mình coi thường, đôi khi luôn rất ghét họ, nhưng khi bình tĩnh lại thì phát hiện ra mình rất ghét bản thân lúc đó, tại sao lòng dạ lại hẹp hòi như vậy?",1,0,0,1,0,0,0,0,0,0,0
"Tự quản lý gặp trở ngại, nghiện điện thoại, không thể ngủ sớm. Có rất nhiều việc phải làm, nên làm, nhưng lại không chịu động tay vào làm.",1,0,0,1,0,0,0,0,0,0,0
"Không biết từ chối công việc không thuộc về mình, không biết từ chối những việc mình không thích lại còn phải cười tươi đón nhận.",1,0,0,1,0,0,0,0,0,0,0
"Rất muốn đôi khi khiêm tốn một chút, nói ít một chút, nhưng bản thân dường như trong những tình huống đó không kìm được, cảm giác khoe khoang này từ đâu mà ra? Rõ ràng bản thân đôi khi cũng tự ti và có lòng tự trọng thấp.",1,0,0,1,0,0,0,0,0,0,0
"Cha mẹ luôn ép tôi làm những việc tôi không thích, tôi chỉ muốn làm những việc tôi thích, muốn chết.",1,0,0,1,0,0,0,0,0,0,0
"Luôn cảm thấy mình chưa đủ giỏi, nghĩ rằng mình chưa đủ giỏi thì sẽ không ai yêu mình, không dám cho phép bản thân dừng lại, nhưng cảm giác này rất mệt mỏi.",1,0,0,1,0,0,0,0,0,0,0
"Luôn quá cầu toàn, cảm thấy mình làm chưa đủ tốt, rất dễ lo lắng.",1,0,0,1,0,0,0,0,0,0,0
"Mỗi ngày về nhà đều làm bài tập, học thuộc bài, không thể sống nổi nữa, tại sao lại phải ép tôi như vậy.",1,0,0,1,0,0,0,0,0,0,0
"Tôi nên chăm chỉ hơn, dù đã đạt được thành tích tốt rồi.",1,0,0,1,0,0,0,0,0,0,0
"Mình phải luôn hoàn hảo, nếu không thì thật đáng thất vọng.",1,0,0,1,0,0,0,0,0,0,0
"Tôi phải giữ vững phong độ này, không được phép mắc lỗi.",1,0,0,1,0,0,0,0,0,0,0
Anh ấy nên hiểu tôi mà không cần tôi nói ra.,1,0,0,1,0,0,0,0,0,0,0
Mình không được làm phiền người khác bằng vấn đề của mình.,1,0,0,1,0,0,0,0,0,0,0
"Tôi phải luôn mạnh mẽ, không được tỏ ra yếu đuối.",1,0,0,1,0,0,0,0,0,0,0
"Cô ấy nên tử tế hơn với tôi, chứ không phải lạnh nhạt như vậy.",1,0,0,1,0,0,0,0,0,0,0
"Mình phải luôn vui vẻ, không được để ai thấy mình buồn.",1,0,0,1,0,0,0,0,0,0,0
Tôi không nên lãng phí thời gian vào những việc vô bổ.,1,0,0,1,0,0,0,0,0,0,0
Mọi người nên công nhận nỗ lực của tôi nhiều hơn.,1,0,0,1,0,0,0,0,0,0,0
Tôi phải hoàn thành công việc này một cách xuất sắc.,1,0,0,1,0,0,0,0,0,0,0
Mình nên biết mọi thứ trước khi bắt đầu làm.,1,0,0,1,0,0,0,0,0,0,0
Tôi không được phép thất bại trong bất kỳ việc gì.,1,0,0,1,0,0,0,0,0,0,0
Anh ấy nên dành nhiều thời gian cho tôi hơn.,1,0,0,1,0,0,0,0,0,0,0
"Tôi phải giúp đỡ mọi người, dù mình có bận đến mấy.",1,0,0,1,0,0,0,0,0,0,0
Mình không nên mắc lỗi ngớ ngẩn như vậy.,1,0,0,1,0,0,0,0,0,0,0
Tôi nên biết cách ứng xử tốt hơn trong mọi tình huống.,1,0,0,1,0,0,0,0,0,0,0
Cô ấy phải đồng ý với ý kiến của tôi.,1,0,0,1,0,0,0,0,0,0,0
Mình phải giữ bình tĩnh dù có chuyện gì xảy ra.,1,0,0,1,0,0,0,0,0,0,0
Tôi phải tìm ra giải pháp cho mọi vấn đề.,1,0,0,1,0,0,0,0,0,0,0
Anh ấy nên gọi điện cho tôi mỗi ngày.,1,0,0,1,0,0,0,0,0,0,0
"Tôi phải luôn lạc quan, không được than vãn.",1,0,0,1,0,0,0,0,0,0,0
Mình không nên tin tưởng ai một cách dễ dàng.,1,0,0,1,0,0,0,0,0,0,0
Tôi phải chứng minh năng lực của mình cho mọi người thấy.,1,0,0,1,0,0,0,0,0,0,0
Cô ấy nên hiểu tôi đang cảm thấy thế nào.,1,0,0,1,0,0,0,0,0,0,0
Mình không nên để cảm xúc chi phối mình.,1,0,0,1,0,0,0,0,0,0,0
Tôi phải luôn sẵn lòng giúp đỡ bạn bè.,1,0,0,1,0,0,0,0,0,0,0
Anh ấy nên xin lỗi tôi vì những gì đã làm.,1,0,0,1,0,0,0,0,0,0,0
Tôi phải biết cách quản lý thời gian hiệu quả hơn.,1,0,0,1,0,0,0,0,0,0,0
Mình không nên bỏ cuộc dễ dàng như vậy.,1,0,0,1,0,0,0,0,0,0,0
Tôi nên tập trung vào công việc hơn.,1,0,0,1,0,0,0,0,0,0,0
Anh ấy phải chấp nhận con người thật của tôi.,1,0,0,1,0,0,0,0,0,0,0
Tôi phải hoàn thành mọi nhiệm vụ được giao.,1,0,0,1,0,0,0,0,0,0,0
Mình không nên để người khác lợi dụng mình.,1,0,0,1,0,0,0,0,0,0,0
Tôi phải luôn nỗ lực hết sức mình.,1,0,0,1,0,0,0,0,0,0,0
Cô ấy nên quan tâm đến tôi nhiều hơn.,1,0,0,1,0,0,0,0,0,0,0
Mình phải luôn giữ lời hứa.,1,0,0,1,0,0,0,0,0,0,0
Tôi phải biết ơn những gì mình đang có.,1,0,0,1,0,0,0,0,0,0,0
Anh ấy nên chia sẻ mọi chuyện với tôi.,1,0,0,1,0,0,0,0,0,0,0
Tôi phải luôn tích cực trong mọi tình huống.,1,0,0,1,0,0,0,0,0,0,0
Mình không nên so sánh mình với người khác.,1,0,0,1,0,0,0,0,0,0,0
Tôi phải luôn học hỏi những điều mới.,1,0,0,1,0,0,0,0,0,0,0
Cô ấy nên hiểu rằng tôi yêu cô ấy.,1,0,0,1,0,0,0,0,0,0,0
Mình phải đối mặt với nỗi sợ hãi của mình.,1,0,0,1,0,0,0,0,0,0,0
Tôi phải chịu trách nhiệm cho những hành động của mình.,1,0,0,1,0,0,0,0,0,0,0
Anh ấy nên tôn trọng ý kiến của tôi.,1,0,0,1,0,0,0,0,0,0,0
Tôi phải kiểm soát cảm xúc của mình tốt hơn.,1,0,0,1,0,0,0,0,0,0,0
Mình không nên lo lắng quá nhiều về tương lai.,1,0,0,1,0,0,0,0,0,0,0
Tôi phải luôn giữ vững lập trường của mình.,1,0,0,1,0,0,0,0,0,0,0
Cô ấy nên tin tưởng vào tôi.,1,0,0,1,0,0,0,0,0,0,0
Mình phải mạnh dạn hơn trong giao tiếp.,1,0,0,1,0,0,0,0,0,0,0
Tôi phải luôn cẩn trọng trong mọi quyết định.,1,0,0,1,0,0,0,0,0,0,0
Anh ấy nên giúp tôi khi tôi gặp khó khăn.,1,0,0,1,0,0,0,0,0,0,0
Tôi phải biết cách tha thứ cho người khác.,1,0,0,1,0,0,0,0,0,0,0
Mình không nên trì hoãn công việc.,1,0,0,1,0,0,0,0,0,0,0
Tôi phải luôn thành thật với chính mình.,1,0,0,1,0,0,0,0,0,0,0
Cô ấy nên hiểu cho hoàn cảnh của tôi.,1,0,0,1,0,0,0,0,0,0,0
Mình phải biết cách chăm sóc bản thân.,1,0,0,1,0,0,0,0,0,0,0
Tôi phải luôn đặt mục tiêu cao hơn.,1,0,0,1,0,0,0,0,0,0,0
Anh ấy nên lắng nghe tôi nhiều hơn.,1,0,0,1,0,0,0,0,0,0,0
Tôi phải giải quyết vấn đề này một cách triệt để.,1,0,0,1,0,0,0,0,0,0,0
Mình không nên tự ti về bản thân.,1,0,0,1,0,0,0,0,0,0,0
Tôi phải luôn giữ vững tinh thần lạc quan.,1,0,0,1,0,0,0,0,0,0,0
Cô ấy nên tin vào khả năng của tôi.,1,0,0,1,0,0,0,0,0,0,0
Mình phải luôn biết cách vượt qua thử thách.,1,0,0,1,0,0,0,0,0,0,0
Tôi phải luôn sống có trách nhiệm.,1,0,0,1,0,0,0,0,0,0,0
Anh ấy nên biết tôi đang nghĩ gì.,1,0,0,1,0,0,0,0,0,0,0
Tôi phải luôn cải thiện bản thân.,1,0,0,1,0,0,0,0,0,0,0
Mình không nên bỏ qua những chi tiết nhỏ.,1,0,0,1,0,0,0,0,0,0,0
Tôi phải luôn đối xử công bằng với mọi người.,1,0,0,1,0,0,0,0,0,0,0
Cô ấy nên hiểu rằng tôi đang cố gắng.,1,0,0,1,0,0,0,0,0,0,0
Mình phải luôn giữ vững niềm tin.,1,0,0,1,0,0,0,0,0,0,0
Tôi phải luôn tìm kiếm cơ hội mới.,1,0,0,1,0,0,0,0,0,0,0
Anh ấy nên khen ngợi tôi nhiều hơn.,1,0,0,1,0,0,0,0,0,0,0
Tôi phải luôn giữ thái độ tích cực.,1,0,0,1,0,0,0,0,0,0,0
Mình không nên phụ thuộc vào người khác.,1,0,0,1,0,0,0,0,0,0,0
Tôi phải luôn giữ lời hứa của mình.,1,0,0,1,0,0,0,0,0,0,0
Cô ấy nên tin tưởng vào tình yêu của tôi.,1,0,0,1,0,0,0,0,0,0,0
Mình phải luôn biết cách tự tạo niềm vui.,1,0,0,1,0,0,0,0,0,0,0
Tôi phải luôn kiên trì theo đuổi mục tiêu.,1,0,0,1,0,0,0,0,0,0,0
Anh ấy nên hiểu rõ mong muốn của tôi.,1,0,0,1,0,0,0,0,0,0,0
Tôi phải luôn biết cách lắng nghe.,1,0,0,1,0,0,0,0,0,0,0
Mình không nên từ bỏ ước mơ của mình.,1,0,0,1,0,0,0,0,0,0,0
Tôi phải luôn biết cách yêu thương bản thân.,1,0,0,1,0,0,0,0,0,0,0
Cô ấy nên chia sẻ gánh nặng với tôi.,1,0,0,1,0,0,0,0,0,0,0
Mình phải luôn tìm cách cải thiện tình hình.,1,0,0,1,0,0,0,0,0,0,0
Tôi phải luôn giữ vững quan điểm của mình.,1,0,0,1,0,0,0,0,0,0,0
Anh ấy nên xin lỗi một cách chân thành.,1,0,0,1,0,0,0,0,0,0,0
Tôi phải luôn học hỏi từ những sai lầm.,1,0,0,1,0,0,0,0,0,0,0
Mình không nên sợ hãi khi đối mặt với thử thách.,1,0,0,1,0,0,0,0,0,0,0
Tôi phải luôn biết cách tạo động lực cho mình.,1,0,0,1,0,0,0,0,0,0,0
Cô ấy nên thấu hiểu những gì tôi đang trải qua.,1,0,0,1,0,0,0,0,0,0,0
Mình phải luôn biết cách thể hiện cảm xúc.,1,0,0,1,0,0,0,0,0,0,0
